{
  "$schema": "http://json-schema.org/draft-07/schema#",
  "title": "BlackLittermanModelData",
  "type": "object",
  "description": "Configuration for the Black-Litterman model with crypto market data and subjective views.",
  "properties": {
    "Model": {
      "type": "string",
      "description": "Model type identifier (e.g., 'BlackLitterman')."
    },
    "Submodel": {
      "type": "string",
      "description": "Name of the specific submodel used under Black-Litterman."
    },
    "AssetSymbols": {
      "type": "array",
      "items": { "type": "string" },
      "description": "List of asset symbols used in the model."
    },
    "ModelParameters": {
      "type": "object",
      "properties": {
        "RiskAversion": {
          "type": "number",
          "description": "Risk aversion coefficient (default = 2.5)."
        },
        "UncertaintyInPrior": {
          "type": "number",
          "description": "Uncertainty in the prior return estimates (default = 0.05)."
        }
      }
    },
    "RiskFreeRates": {
      "type": "array",
      "description": "List of risk-free rates by term.",
      "items": {
        "type": "object",
        "properties": {
          "term": {
            "type": "string",
            "pattern": "^[1-9]\\d*(B|D|W|M|Y)$",
            "description": "Term (e.g., '1B', '3D', '2M')."
          },
          "rate": {
            "type": "number",
            "description": "Risk-free rate (e.g., 0.0175)."
          }
        },
        "required": ["term", "rate"]
      }
    },
    "PortfolioViews": {
      "type": "array",
      "description": "List of subjective return views for selected asset combinations.",
      "items": {
        "type": "object",
        "properties": {
          "Symbols": {
            "type": "array",
            "items": { "type": "string" },
            "description": "Assets involved in the view."
          },
          "Weights": {
            "type": "array",
            "items": { "type": "number" },
            "description": "Portfolio weights for each asset in the view."
          },
          "ExpectedReturn": {
            "type": "number",
            "description": "Expected return for the view (e.g., 0.05 = 5%)."
          },
          "Confidence": {
            "type": "number",
            "description": "Confidence in the view (0 to 1)."
          }
        },
        "required": ["Symbols", "Weights", "ExpectedReturn", "Confidence"]
      }
    },
    "AssetStaticData": {
      "type": "array",
      "description": "Metadata for each asset used in the model.",
      "items": {
        "type": "object",
        "properties": {
          "Pool": {
            "type": "string",
            "description": "Name of the liquidity pool (optional)."
          },
          "Project": {
            "type": "string",
            "description": "Name of the DeFi project (optional)."
          },
          "Chain": {
            "type": "string",
            "description": "Blockchain where the asset or pool exists (optional)."
          },
          "Symbol": {
            "type": "string",
            "description": "Asset symbol (required)."
          }
        },
        "required": ["Symbol"]
      }
    }
  },
  "required": ["Model", "Submodel", "AssetSymbols", "ModelParameters", "AssetStaticData"]
}
