{
  "Model": "BlackLitterman",
  "Submodel": "ExplicitExcessReturnView-v0",
  "AssetSymbols": ["stETH", "GHO", "USDC", "WBTC"],
  "ModelParameters": {
    "RiskAversion": 2.5,
    "UncertaintyInPrior": 0.05
  },
  "RiskFreeRates": [
    {
      "term": "1Y",
      "rate": 0.0175
    }
  ],
  "PortfolioViews": [
    {
      "Symbols": [
        "stETH", "GHO", "USDC", "WBTC"
      ],
      "Weights": [
        1, 0, 0, 0
      ],
      "ExpectedReturn": 0.025,
      "Confidence": 0.5
    },
    {
      "Symbols": [
        "stETH", "GHO", "USDC", "WBTC"
      ],
      "Weights": [
        0, 1, 0, 0
      ],
      "ExpectedReturn": 0.16,
      "Confidence": 0.5
    },
    {
      "Symbols": [
        "stETH", "GHO", "USDC", "WBTC"
      ],
      "Weights": [
        0, 0, 1, 0
      ],
      "ExpectedReturn": 0.03,
      "Confidence": 0.5
    },
        {
      "Symbols": [
        "stETH", "GHO", "USDC", "WBTC"
      ],
      "Weights": [
        1, 0, 0, -1
      ],
      "ExpectedReturn": 0.005,
      "Confidence": 0.75
    }
  ],
  "AssetStaticData": [
    {
      "Symbol": "stETH",
      "Pool": "STETH Pool",
      "Project": "Lido",
      "Chain": "Ethereum"
    },
    {
      "Symbol": "GHO",
      "Pool": "GHO Pool",
      "Project": "Aave",
      "Chain": "Ethereum"
    },
    {
      "Symbol": "USDC",
      "Pool": "USDC Pool",
      "Project": "Circle",
      "Chain": "Ethereum"
    },
    {
      "Symbol": "WBTC",
      "Pool": "WBTC Pool",
      "Project": "BitGo",
      "Chain": "Ethereum"
    }
  ]
}
